commit	throughput_mib_s	stdev_mib_s	status	description
a1b2c3d	4014.39	132.77	keep	baseline (256 threads, single stream)
b2c3d4e	4012.05	156.70	discard	increase all block sizes to 512
c3d4e5f	3950.65	199.63	discard	decrease all block sizes to 128
d4e5f6g	4058.26	111.16	keep	return to 256 threads, add tunable header + autoresearch harness
e5f6g7h	3908.27	120.45	discard	multi-stream chunking (2 streams) — slower for < 200 MB payload
f6g7h8i	4058.26	111.16	keep	revert to single stream, final tuned config
